Scl,Sculptor,"Sculptor is a small and faint constellation in the southern sky. It represents a sculptor. It was introduced by Nicolas Louis de Lacaille in the 18th century. He originally named it Apparatus Sculptoris (the sculptor's studio), but the name was later shortened."
Boo,Boötes,"Boötes  is a constellation in the northern sky, located between 0° and +60° declination, and 13 and 16 hours of right ascension on the celestial sphere. The name comes from the Greek Βοώτης, Boōtēs, meaning herdsman or plowman (literally, ox-driver; from βοῦς bous “cow”). The ""ö"" in the name is a diaeresis, not an umlaut, meaning that each 'o' is to be pronounced separately.
One of the 48 constellations described by the 2nd century astronomer Ptolemy, Boötes is now one of the 88 modern constellations. It contains the fourth brightest star in the night sky, the orange-hued Arcturus. Boötes is home to many other bright stars, including eight above the fourth magnitude and an additional 21 above the fifth magnitude, making a total of 29 stars easily visible to the naked eye."
Car,Carina,"Carina  is a constellation in the southern sky. Its name is Latin for the keel of a ship, and it was formerly part of the larger constellation of Argo Navis (the ship Argo) until that constellation was divided into three pieces, the other two being Puppis (the poop deck), and Vela (the sails of the ship)."
Dra,Draco,"Draco is a constellation in the far northern sky. Its name is Latin for dragon. It was one of the 48 constellations listed by the 2nd century astronomer Ptolemy and remains one of the 88 modern constellations today. The north pole of the ecliptic is in Draco. Draco is circumpolar (that is, never setting), and can be seen all year from northern latitudes."
Aql,Aquila,"Aquila is a constellation in the northern sky. Its name is Latin for 'eagle' and it represents the bird who carried Zeus/Jupiter's thunderbolts in Greco-Roman mythology.
Aquila lies astride the celestial equator. The alpha star, Altair, is a vertex of the Summer Triangle asterism. The constellation is best seen in the summer as it is located along the Milky Way. Because of this location along the line of our galaxy, many clusters and nebulae are found within its borders, but they are dim and there are few galaxies."
Crt,Crater,"Crater is a constellation. Its name is Latin for cup, and in Greek mythology it is identified with the cup of the god Apollo. It was one of the 48 constellations listed by the 2nd century astronomer Ptolemy, and remains one of the 88 modern constellations. It is faint, with no star brighter than third magnitude.

"
Cas,Cassiopeia,"Cassiopeia is a constellation in the northern sky, named after the vain queen Cassiopeia in Greek mythology, who boasted about her unrivalled beauty. Cassiopeia was one of the 48 constellations listed by the 2nd-century Greek astronomer Ptolemy, and it remains one of the 88 modern constellations today. It is easily recognizable due to its distinctive 'M' shape when in upper culmination but in higher northern locations when near lower culminations in spring and summer it has a 'W' shape, formed by five bright stars. It is bordered by Andromeda to the south, Perseus to the southeast, and Cepheus to the north. It is opposite the Big Dipper. In northern locations above 34ºN latitude it is visible year-round and in the (sub)tropics it can be seen at its clearest from September to early November in its characteristic 'M' shape. Even in low southern latitudes below 25ºS it can be seen low in the North.

"
Tau,Taurus,"Taurus (Latin for ""the Bull""; symbol: , Unicode: ♉) is one of the constellations of the zodiac, which means it is crossed by the plane of the ecliptic. Taurus is a large and prominent constellation in the northern hemisphere's winter sky. It is one of the oldest constellations, dating back to at least the Early Bronze Age when it marked the location of the Sun during the spring equinox. Its importance to the agricultural calendar influenced various bull figures in the mythologies of Ancient Sumer, Akkad, Assyria, Babylon, Egypt, Greece, and Rome.
There are a number of features of interest to astronomers. Taurus hosts two of the nearest open clusters to Earth, the Pleiades and the Hyades, both of which are visible to the naked eye. At first magnitude, the red giant Aldebaran is the brightest star in the constellation. In the northwest part of Taurus is the supernova remnant Messier 1, more commonly known as the Crab Nebula. One of the closest regions of active star formation, the Taurus-Auriga complex, crosses into the northern part of the constellation. The variable star T Tauri is the prototype of a class of pre-main-sequence stars."
TrA,Triangulum Australe,"Triangulum Australe is a small constellation in the far Southern Celestial Hemisphere. Its name is Latin for ""the southern triangle"", which distinguishes it from Triangulum in the northern sky and is derived from the almost equilateral pattern of its three brightest stars. It was first depicted on a celestial globe as Triangulus Antarcticus by Petrus Plancius in 1589, and later with more accuracy and its current name by Johann Bayer in his 1603 Uranometria. The French explorer and astronomer Nicolas Louis de Lacaille charted and gave the brighter stars their Bayer designations in 1756.
Alpha Trianguli Australis, known as Atria, is a second magnitude orange giant and the brightest star in the constellation, as well as the 42nd-brightest star in the night sky. Completing the triangle are the two white main sequence stars Beta and Gamma Trianguli Australis. Although the constellation lies in the Milky Way and contains many stars, deep-sky objects are not prominent. Notable features include the open cluster NGC 6025 and planetary nebula NGC 5979."
Crv,Corvus,"Corvus is a small constellation in the Southern Celestial Hemisphere. Its name comes from the Latin word ""raven"" or ""crow"". It includes only 11 stars with brighter than 4.02 magnitudes. One of the 48 constellations listed by the 2nd-century astronomer Ptolemy, it remains one of the 88 modern constellations. The four brightest stars, Gamma, Delta, Epsilon, and Beta Corvi form a distinctive quadrilateral in the night sky. The young star Eta Corvi has been found to have two debris disks."
PsA,Piscis Austrinus,"Piscis Austrinus (also known as Piscis Australis) is a constellation in the southern celestial hemisphere. The name is Latin for ""the southern fish"", in contrast with the larger constellation Pisces, which represents a pair of fishes. Prior to the 20th century, it was also known as Piscis Notius. Its only star brighter than 4th magnitude is Fomalhaut, which is a first-magnitude star and is the 18th brightest star in the night sky.
Piscis Austrinus was one of the 48 constellations listed by the 2nd century astronomer Ptolemy, and it remains one of the 88 modern constellations. The stars of the modern constellation Grus once formed the ""tail"" of Piscis Austrinus. In 1597 (or 1598), Petrus Plancius carved out a separate constellation and named it after the crane.

In Greek mythology, this constellation is known as the Great Fish and it is portrayed as swallowing the water being poured out by Aquarius, the water-bearer constellation. The two fish of the constellation Pisces are said to be the offspring of the Great Fish. In Egyptian mythology, this fish saved the life of the Egyptian goddess Isis, so she placed this fish and its descendants into the heavens as constellations of stars."
Cha,Chamaeleon,"Chamaeleon () is a small constellation in the southern sky. It is named after the chameleon, a kind of lizard. It was first defined in the 16th century."
Tel,Telescopium,"Telescopium is a minor constellation in the southern celestial hemisphere, one of twelve named in the 18th century by French astronomer Nicolas-Louis de Lacaille and one of several depicting scientific instruments. Its name is a Latinized form of the Greek word for telescope. Telescopium was later much reduced in size by Francis Baily and Benjamin Gould.
The brightest star in the constellation is Alpha Telescopii, a blue-white subgiant with an apparent magnitude of 3.5, followed by the orange giant star Zeta Telescopii at magnitude 4.1. Eta and PZ Telescopii are two young star systems with debris disks and brown dwarf companions. Telescopium hosts two unusual stars with very little hydrogen that are likely to be the result of two merged white dwarfs: PV Telescopii, also known as HD 168476, is a hot blue extreme helium star, while RS Telescopii is an R Coronae Borealis variable. RR Telescopii is a cataclysmic variable that brightened as a nova to magnitude 6 in 1948."
Cep,Cepheus,"Cepheus is a constellation in the northern sky. It is named after Cepheus, King of Aethiopia in Greek mythology. It was one of the 48 constellations listed by the 2nd century astronomer Ptolemy, and remains one of the 88 modern constellations. Its brightest star is Alpha Cephei with an apparent magnitude of 3.5. Delta Cephei is the prototype of an important class of star known as a Cepheid variable. RW Cephei, an orange hypergiant, together with the red supergiants Mu Cephei, VV Cephei and V354 Cephei are among the largest stars known. In addition, Cepheus also has the hyperluminous quasar S5 0014+81, hosting an ultramassive black hole in its core at 40 billion solar masses, about 10,000 times more massive than the central black hole of the Milky Way, making it the most massive black hole known in the universe."
Pic,Pictor,"Pictor is a constellation in the Southern Celestial Hemisphere, located between the star Canopus and the Large Magellanic Cloud. Its name is Latin for painter, and is an abbreviation of the older name Equuleus Pictoris (the ""painter's easel""). Normally represented as an easel, Pictor was named by Abbé Nicolas-Louis de Lacaille in the 18th century. The constellation's brightest star is Alpha Pictoris, a white main-sequence star around 97 light-years away from Earth. Pictor also hosts RR Pictoris, a cataclysmic variable star system that flared up as a nova, reaching apparent (visual) magnitude 1.2 in 1925 before fading into obscurity.
Pictor has attracted attention because of its second-brightest star Beta Pictoris, 63.4 light-years distant from Earth, which is surrounded by an unusual dust disk rich in carbon, as well as an exoplanet (extrasolar planet). Another five stars in the constellation have been observed to have planets. Among them is HD 40307, an orange dwarf that has six planets orbiting it, one of which—HD 40307 g—is a potential super-Earth in the circumstellar habitable zone. Kapteyn's Star, the nearest star in Pictor to Earth, is a red dwarf located 12.76 light-years away that was found to have two super-Earths in orbit in 2014. Pictor A is a radio galaxy that is shooting an 800,000 light-year long jet of plasma from a supermassive black hole at its centre. In 2006, a gamma-ray burst—GRB 060729—was observed in Pictor, its extremely long X-ray afterglow detectable for nearly two years."
Ant,Antlia,"Antlia (; from Ancient Greek ἀντλία) is a constellation in the southern sky. Its name means ""pump"" and it specifically represents an air pump. Abbreviated from Antlia Pneumatica, the constellation was introduced by Nicolas Louis de Lacaille in the 18th century. Located close to those forming the old constellation of the ship Argo Navis, Antlia is completely visible from latitudes south of 49 degrees north
Antlia is a faint constellation; its brightest star is Alpha Antliae is an orange giant that is a suspected variable star, ranging between apparent magnitudes 4.22 and 4.29. Two star systems have known exoplanets. NGC 2997, a spiral galaxy, and the Antlia Dwarf Galaxy lie within Antlia's borders."
Cru,Crux,"Crux  is a constellation located in the southern sky in a bright portion of the Milky Way, being among the most distinctive even though it is the smallest of all 88 modern constellations. Its name is Latin for cross, and it is dominated by a cross-shaped or kite-like asterism that is commonly known as the Southern Cross.
Predominating the asterism is the most southerly first-magnitude star and brightest star in the constellation, the blue-white Alpha Crucis or Acrux, followed by four other stars, descending in clockwise order by magnitude: Beta, Gamma (one of the closest red giants to Earth), Delta and Epsilon Crucis. Many of these brighter stars are members of the Scorpius–Centaurus Association, a large but loose group of hot blue-white stars that appear to share common origins and motion across the southern Milky Way. The constellation contains four Cepheid variables that are visible to the naked eye under optimum conditions. Crux also contains the bright and colourful open cluster known as the Jewel Box (NGC 4755) and, to the southwest, partly includes the extensive dark nebula, known as the Coalsack Nebula."
Pav,Pavo,"Pavo is a constellation in the southern sky with the Latin name for peacock. It is one of twelve constellations conceived by Petrus Plancius from the observations of Pieter Dirkszoon Keyser and Frederick de Houtman. Pavo first appeared on a 35-cm (14 in) diameter celestial globe published in 1598 in Amsterdam by Plancius and Jodocus Hondius and was depicted in Johann Bayer's star atlas Uranometria of 1603. French explorer and astronomer Nicolas Louis de Lacaille gave its stars Bayer designations in 1756. The constellations Pavo, Grus, Phoenix and Tucana are collectively known as the ""Southern Birds"".
The constellation's brightest member, Alpha Pavonis, is also known as Peacock and appears as a 1.91-magnitude blue-white star, but is actually a spectroscopic binary. Delta Pavonis is a nearby Sun-like star some 19.9 light years distant. Six of the star systems in Pavo have been found to host planets, including HD 181433 with a super-earth, and HD 172555 with evidence of a major interplanetary collision in the past few thousand years. The constellation contains NGC 6752, the third-brightest globular cluster in the sky, and the spiral galaxy NGC 6744, which closely resembles our Milky Way but is twice as large. Pavo is the radiant of two annual meteor showers: the Delta Pavonids and August Pavonids."
Lib,Libra,"Libra  is a constellation of the zodiac. Its name is Latin for weighing scales, and its symbol is  (Unicode ♎). It is fairly faint, with no first magnitude stars, and lies between Virgo to the west and Scorpius to the east. Beta Librae, also known as Zubeneschamali, is the brightest star in the constellation. Three star systems have planets."
Com,Coma Berenices,"Coma Berenices is a traditional asterism that has since been defined as one of the 88 modern constellations. It is located near Arcturus, and the constellation Leo to which it formerly belonged, and contains the North Galactic Pole. Its name means ""Berenice's Hair"" (in Greek, via Latin), and refers to the legend of Queen Berenice II of Egypt, who sacrificed her long hair."
Tri,Triangulum,"Triangulum is a small constellation in the northern sky. Its name is Latin for ""triangle"", derived from its three brightest stars, which form a long and narrow triangle. Known to the ancient Babylonians and Greeks, Triangulum was one of the 48 constellations listed by the 2nd century astronomer Ptolemy. The celestial cartographers Johann Bayer and John Flamsteed catalogued the constellation's stars, giving six of them Bayer designations.
The white stars Beta and Gamma Trianguli, of apparent magnitudes 3.00 and 4.00, respectively, form the base of the triangle and the yellow-white Alpha Trianguli, of magnitude 3.41, the apex. Iota Trianguli is a notable double star system, and there are three star systems with planets located in Triangulum. The constellation contains several galaxies, the brightest and nearest of which is the Triangulum Galaxy or Messier 33—a member of the Local Group. The first quasar ever observed, 3C 48, also lies within Triangulum's boundaries."
Gem,Gemini,"Gemini is one of the constellations of the zodiac. It was one of the 48 constellations described by the 2nd century AD astronomer Ptolemy and it remains one of the 88 modern constellations today. Its name is Latin for ""twins,"" and it is associated with the twins Castor and Pollux in Greek mythology. Its symbol is  (Unicode ♊)."
Peg,Pegasus,"Pegasus is a constellation in the northern sky, named after the winged horse Pegasus in Greek mythology. It was one of the 48 constellations listed by the 2nd-century astronomer Ptolemy, and is one of the 88 constellations recognised today.
With an apparent magnitude varying between 2.37 and 2.45, the brightest star in Pegasus is the orange supergiant Epsilon Pegasi, also known as Enif, which marks the horse's muzzle. Alpha (Markab), Beta (Scheat), and Gamma (Algenib), together with Alpha Andromedae (Alpheratz or Sirrah) form the large asterism known as the Square of Pegasus. Twelve star systems have been found to have exoplanets."
Cet,Cetus,"Cetus () is a constellation. Its name refers to Cetus, a sea monster in Greek mythology, although it is often called 'the whale' today. Cetus is located in the region of the sky that contains other water-related constellations such as Aquarius, Pisces, and Eridanus."
Pup,Puppis,"Puppis  is a constellation in the southern sky. Puppis, the Poop Deck, was originally part of an over-large constellation, the ship of ""Jason and the Argonauts"", Argo Navis, which centuries after its initial description, was divided into three parts, the other two being Carina (the keel and hull), and Vela (the sails of the ship). Puppis is the largest of the three constellations in square degrees. It is one of the 88 modern constellations recognized by the International Astronomical Union."
Equ,Equuleus,"Equuleus  is a constellation. Its name is Latin for 'little horse', a foal. It was one of the 48 constellations listed by the 2nd century astronomer Ptolemy, and remains one of the 88 modern constellations. It is the second smallest of the modern constellations (after Crux), spanning only 72 square degrees. It is also very faint, having no stars brighter than the fourth magnitude."
Cen,Centaurus,"Centaurus  is a bright constellation in the southern sky. One of the largest constellations, Centaurus was included among the 48 constellations listed by the 2nd century astronomer Ptolemy, and it remains one of the 88 modern constellations. In Greek mythology, Centaurus represents a centaur; a creature that is half human, half horse (another constellation named after a centaur is one from the zodiac: Sagittarius). Notable stars include Alpha Centauri, the nearest star system to the Solar System, its neighbour in the sky Beta Centauri, and V766 Centauri, one of the largest stars yet discovered. The constellation also contains Omega Centauri, the brightest globular cluster as visible from Earth and one of the largest known."
Cnc,Cancer,"Cancer is one of the twelve constellations of the zodiac. Its name is Latin for crab and it is commonly represented as one. Its astrological symbol is  (Unicode ♋). Cancer is a medium-size constellation with an area of 506 square degrees and its stars are rather faint, its brightest star Beta Cancri having an apparent magnitude of 3.5. It contains two stars with known planets, including 55 Cancri, which has five: one super-earth and four gas giants, one of which is in the habitable zone and as such has expected temperatures similar to Earth. Located at the center of the constellation is Praesepe (Messier 44), one of the closest open clusters to Earth and a popular target for amateur astronomers."
Pyx,Pyxis,"Pyxis (; Greek: box) is a small and faint constellation in the southern sky. Abbreviated from Pyxis Nautica, its name is Latin for a mariner's compass (contrasting with Circinus, which represents a draftsman's compasses). Pyxis was introduced by Nicolas Louis de Lacaille in the 18th century. The constellation is located close to those forming the old constellation of the ship Argo Navis, and in the 19th century astronomer John Herschel suggested renaming Pyxis to Malus, the mast, but the suggestion was not followed. Pyxis is completely visible from latitudes south of 53 degrees north, with its best evening-sky visibility in February and March.
The plane of the Milky Way passes through Pyxis. A faint constellation, its three brightest stars—Alpha, Beta and Gamma Pyxidis—are in a rough line. At magnitude 3.68, Alpha is the constellation's brightest star. It is a blue-white star around 22,000 times as luminous as the Sun. Near Alpha is T Pyxidis, a recurrent nova that has flared up to magnitude 7 every few decades. Three star systems have planets, all discovered by doppler spectroscopy."
Del,Delphinus,"Delphinus  is a constellation in the northern sky, close to the celestial equator. Its name is Latin for dolphin. Delphinus was one of the 48 constellations listed by the 2nd century astronomer Ptolemy, and it remains among the 88 modern constellations recognized by the International Astronomical Union. It is one of the smaller constellations, ranked 69th in size.
Delphinus' brightest stars form a distinctive asterism that can easily be recognized. It is bordered (clockwise from north) by Vulpecula the fox Sagitta the arrow, Aquila the eagle, Aquarius the water-carrier, Equuleus the foal and Pegasus the flying horse."
Ara,Ara,"Ara is a southern constellation situated between Scorpius and Triangulum Australe. Its Latin name is Latin for ""altar"". Ara was one of the 48 Greek constellations described by the 2nd century astronomer Ptolemy, and it remains one of the 88 modern constellations defined by the International Astronomical Union."
Sgr,Sagittarius,"Sagittarius is one of the constellations of the zodiac. It is one of the 48 constellations listed by the 2nd-century astronomer Ptolemy and remains one of the 88 modern constellations. Its name is Latin for the archer, and its symbol is  (Unicode U+2650 ♐), a stylized arrow. Sagittarius is commonly represented as a centaur pulling-back a bow. It lies between Scorpius and Ophiuchus to the west and Capricornus to the east.
The centre of the Milky Way lies in the westernmost part of Sagittarius (see Sagittarius A)."
CMa,Canis Major,"Canis Major  is a constellation in the southern celestial hemisphere. In the second century, it was included in Ptolemy's 48 constellations, and is counted among the 88 modern constellations. Its name is Latin for ""greater dog"" in contrast to Canis Minor, the ""lesser dog""; both figures are commonly represented as following the constellation of Orion the hunter through the sky. The Milky Way passes through Canis Major and several open clusters lie within its borders, most notably M41.
Canis Major contains Sirius, the brightest star in the night sky, known as the ""dog star"". It is bright because of its proximity to the Solar System. In contrast, the other bright stars of the constellation are stars of great distance and high luminosity. At magnitude 1.5, Epsilon Canis Majoris (Adhara) is the second brightest star of the constellation and the brightest source of extreme ultraviolet radiation in the night sky. Next in brightness are the yellow-white supergiant Delta (Wezen) at 1.8, the blue-white giant Beta (Mirzam) at 2.0, blue-white supergiants Eta (Aludra) at 2.4 and Omicron1 at 3.0, and white spectroscopic binary Zeta (Furud), also at 3.0. The red hypergiant VY Canis Majoris is one of the largest stars known, while the neutron star RX J0720.4-3125 has a radius of a mere 5 km.

"
Hyi,Hydrus,"Hydrus  is a small constellation in the deep southern sky. It was first depicted on a celestial atlas by Johann Bayer in his 1603 Uranometria. The French explorer and astronomer Nicolas Louis de Lacaille charted the brighter stars and gave their Bayer designations in 1756. Its name means ""male water snake"", as opposed to Hydra, a much larger constellation that represents a female water snake. It remains below the horizon for most Northern Hemisphere observers.
The brightest star is the 2.8-magnitude Beta Hydri, also the closest reasonably bright star to the south celestial pole. Pulsating between magnitude 3.26 and 3.33, Gamma Hydri is a variable red giant some 60 times the diameter of our Sun. Lying near it is VW Hydri, one of the brightest dwarf novae in the heavens. Four star systems have been found to have exoplanets to date, most notably HD 10180, which could bear up to nine planetary companions."
Ind,Indus,Indus is a constellation in the southern sky created in the late sixteenth century.
Hor,Horologium,"Horologium is a faint constellation in the southern sky. It was devised by French astronomer Nicolas Louis de Lacaille in 1752, and it remains one of the 88 modern constellations. The constellation's brightest star is Alpha Horologii, an orange giant. R Horologii is a red giant Mira variable with one of the widest ranges in brightness known. Two star systems have exoplanets, while Nu Horologii has a debris disk."
Hya,Hydra,"Hydra is the largest of the 88 modern constellations, measuring 1303 square degrees. Also one of the longest at over 100 degrees, its southern end abuts Libra and Centaurus and its northern end borders Cancer. It has a long history, having been included among the 48 constellations listed by the 2nd century astronomer Ptolemy. It is commonly represented as a water snake. It should not be confused with the similarly named constellation of Hydrus."
