Per,Perseus,"Perseus, named after the Greek mythological hero Perseus, is a constellation in the northern sky. It is one of the 48 listed by the 2nd-century astronomer Ptolemy, and among the 88 modern constellations defined by the International Astronomical Union (IAU). It is located in the northern celestial hemisphere near several other constellations named after ancient Greek legends surrounding Perseus, including Andromeda to the west and Cassiopeia to the north. Perseus is also bordered by Aries and Taurus to the south, Auriga to the east, Camelopardalis to the north, and Triangulum to the west. Some star atlases during the early 19th century also depicted Perseus holding onto the head of the Medusa, whose asterism was named together as Perseus et Caput Medusae, however, this never came into popular usage.
The galactic plane of the Milky Way passes through Perseus but is mostly obscured by molecular clouds. The constellation's brightest star is the yellow-white supergiant Alpha Persei (also called Mirfak), which shines at magnitude 1.79. It and many of the surrounding stars are members of an open cluster known as the Alpha Persei Cluster. The best-known star, however, is Algol (Beta Persei), linked with ominous legends because of its variability, which is noticeable to the naked eye. Rather than being an intrinsically variable star, it is an eclipsing binary. Other notable star systems in Perseus include X Persei, a binary system containing a neutron star, and GK Persei, a nova that peaked at magnitude 0.2 in 1901. The Double Cluster, comprising two open clusters quite near each other in the sky, was known to the ancient Chinese. The constellation gives its name to the Perseus cluster (Abell 426), a massive galaxy cluster located 250 million light-years from Earth. It hosts the radiant of the annual Perseids meteor shower—one of the most prominent meteor showers in the sky."
Cyg,Cygnus,"Cygnus  is a northern constellation lying on the plane of the Milky Way, deriving its name from the Latinized Greek word for swan. The swan is one of the most recognizable constellations of the northern summer and autumn, it features a prominent asterism known as the Northern Cross (in contrast to the Southern Cross). Cygnus was among the 48 constellations listed by the 2nd century astronomer Ptolemy, and it remains one of the 88 modern constellations.
Cygnus contains Deneb, one of the brightest stars in the night sky and one corner of the Summer Triangle, as well as some notable X-ray sources and the giant stellar association of Cygnus OB2. One of the stars of this association, NML Cygni, is one of the largest stars currently known. The constellation is also home to Cygnus X-1, a distant X-ray binary containing a supergiant and unseen massive companion that was the first object widely held to be a black hole. Many star systems in Cygnus have known planets as a result of the Kepler Mission observing one patch of the sky, the patch is the area around Cygnus. In addition, most of the eastern part of Cygnus is dominated by the Hercules–Corona Borealis Great Wall, a giant galaxy filament that is the largest known structure in the observable universe; covering most of the northern sky."
LMi,Leo Minor,"Leo Minor is a small and faint constellation in the northern celestial hemisphere. Its name is Latin for ""the smaller lion"", in contrast to Leo, the larger lion. It lies between the larger and more recognizable Ursa Major to the north and Leo to the south. Leo Minor was not regarded as a separate constellation by classical astronomers; it was designated by Johannes Hevelius in 1687.
There are 37 stars brighter than apparent magnitude 6.5 in the constellation; three are brighter than magnitude 4.5. 46 Leonis Minoris, an orange giant of magnitude 3.8, is located some 95 light-years from Earth. At magnitude 4.4, Beta Leonis Minoris is the second brightest star and the only one in the constellation with a Bayer designation. It is a binary star, the brighter component of which is an orange giant and the fainter a yellow-white main sequence star. The third brightest star is 21 Leonis Minoris, a rapidly rotating white main-sequence star of average magnitude 4.5. The constellation also includes two stars with planetary systems, two pairs of interacting galaxies, and the unique deep-sky object Hanny's Voorwerp."
Aqr,Aquarius,"Aquarius is a constellation of the zodiac, situated between Capricornus and Pisces. Its name is Latin for ""water-carrier"" or ""cup-carrier"", and its symbol is  (Unicode ♒), a representation of water.
Aquarius is one of the oldest of the recognized constellations along the zodiac (the sun's apparent path). It was one of the 48 constellations listed by the 2nd century AD astronomer Ptolemy, and it remains one of the 88 modern constellations. It is found in a region often called the Sea due to its profusion of constellations with watery associations such as Cetus the whale, Pisces the fish, and Eridanus the river."
Sco,Scorpius,"Scorpius is one of the constellations of the zodiac. Its name is Latin for scorpion, and its symbol is  (Unicode ♏). It lies between Libra to the west and Sagittarius to the east. It is a large constellation located in the southern hemisphere near the center of the Milky Way."
Mic,Microscopium,"Microscopium  is a minor constellation in the Southern Celestial Hemisphere, one of twelve created in the 18th century by French astronomer Nicolas Louis de Lacaille and one of several depicting scientific instruments. Its name is a Latinised form of the Greek word for microscope. Its stars are faint and hardly visible from most of the non-tropical Northern Hemisphere.
The constellation's brightest star is Gamma Microscopii of apparent magnitude 4.68, a yellow giant located around 381 light-years distant. Two star systems—WASP-7 and HD 205739—have planets, while two others—the young red dwarf star AU Microscopii and the sunlike HD 202628—have debris disks. AU Microscopii and the binary red dwarf system AT Microscopii are probably a wide triple system and members of the Beta Pictoris moving group. Nicknamed ""Speedy Mic"", BO Microscopii is a star with an extremely fast rotation period of 9 hours 7 minutes."
Phe,Phoenix,"Phoenix is a minor constellation in the southern sky. Named after the mythical phoenix, it was first depicted on a celestial atlas by Johann Bayer in his 1603 Uranometria. The French explorer and astronomer Nicolas Louis de Lacaille charted the brighter stars and gave their Bayer designations in 1756. The constellation stretches from roughly −39° to −57° declination, and from 23.5h to 2.5h of right ascension. The constellations Phoenix, Grus, Pavo and Tucana, are known as the Southern Birds.
The brightest star, Alpha Phoenicis, is named Ankaa, an Arabic word meaning 'the Phoenix'. It is an orange giant of apparent magnitude 2.4. Next is Beta Phoenicis, actually a binary system composed of two yellow giants with a combined apparent magnitude of 3.3. Nu Phoenicis has a dust disk, while the constellation has ten star systems with known planets and the recently discovered galaxy clusters El Gordo and the Phoenix Cluster—located 7.2 and 5.7 billion light years away respectively, two of the largest objects in the visible universe. Phoenix is the radiant of two annual meteor showers: the Phoenicids in December, and the July Phoenicids."
Leo,Leo,"Leo  is one of the constellations of the zodiac, lying between Cancer to the west and Virgo to the east. Its name is Latin for lion, and to the ancient Greeks represented the Nemean Lion killed by the mythical Greek hero Heracles (known to the ancient Romans as Hercules) as one of his twelve labors. Its symbol is  (Unicode ♌). One of the 48 constellations described by the 2nd century astronomer Ptolemy, Leo remains one of the 88 modern constellations today, and one of the most easily recognizable due to its many bright stars and a distinctive shape that is reminiscent of the crouching lion it depicts. The lion's mane and shoulders also form an asterism known as ""the Sickle,"" which to modern observers may resemble a backwards ""question mark."""
Sge,Sagitta,"Sagitta is a dim but distinctive constellation in the northern sky. Its name is Latin for ""arrow"", and it should not be confused with the larger constellation Sagittarius, the archer. Although Sagitta is an ancient constellation, it has no star brighter than 3rd magnitude and has the third-smallest area of all constellations (only Equuleus and Crux are smaller). It was included among the 48 constellations listed by the 2nd century astronomer Ptolemy, and it remains one of the 88 modern constellations defined by the International Astronomical Union. Located to the north of the equator, Sagitta can be seen from every location on Earth except within the Antarctic circle.
The red giant Gamma Sagittae is the constellation's brightest star, with an apparent magnitude of 3.47. Two star systems have been found to have planets."
Lac,Lacerta,"Lacerta is one of the 88 modern constellations defined by the International Astronomical Union. Its name is Latin for lizard. A small, faint constellation, it was created in 1687 by the astronomer Johannes Hevelius. Its brightest stars form a ""W"" shape similar to that of Cassiopeia, and it is thus sometimes referred to as 'Little Cassiopeia'. It is located between Cygnus, Cassiopeia and Andromeda on the northern celestial sphere. The northern part lies on the Milky Way."
Oph,Ophiuchus,Ophiuchus  and Anguitenens.
Ari,Aries,"Aries is one of the constellations of the zodiac. It is located in the northern celestial hemisphere between Pisces to the west and Taurus to the east. The name Aries is Latin for ram, and its symbol is  (Unicode ♈), representing a ram's horns. It is one of the 48 constellations described by the 2nd century astronomer Ptolemy, and remains one of the 88 modern constellations. It is a mid-sized constellation, ranking 39th overall size, with an area of 441 square degrees (1.1% of the celestial sphere).
Although Aries came to represent specifically the ram whose fleece became the Golden Fleece of Ancient Greek mythology, it has represented a ram since late Babylonian times. Before that, the stars of Aries formed a farmhand. Different cultures have incorporated the stars of Aries into different constellations including twin inspectors in China and a porpoise in the Marshall Islands. Aries is a relatively dim constellation, possessing only four bright stars: Hamal (Alpha Arietis, second magnitude), Sheratan (Beta Arietis, third magnitude), Mesarthim (Gamma Arietis, fourth magnitude), and 41 Arietis (also fourth magnitude). The few deep-sky objects within the constellation are quite faint and include several pairs of interacting galaxies. Several meteor showers appear to radiate from Aries, including the Daytime Arietids and the Epsilon Arietids."
Lyr,Lyra,"Lyra (; Latin for lyre, from Greek λύρα) is a small constellation. It is one of 48 listed by the 2nd century astronomer Ptolemy, and is one of the 88 constellations recognized by the International Astronomical Union. Lyra was often represented on star maps as a vulture or an eagle carrying a lyre, and hence sometimes referred to as Aquila Cadens or Vultur Cadens. Beginning at the north, Lyra is bordered by Draco, Hercules, Vulpecula, and Cygnus. Lyra is visible from the northern hemisphere from spring through autumn, and nearly overhead, in temperate latitudes, during the summer months. From the southern hemisphere, it is visible low in the northern sky during the winter months.
Vega, Lyra's brightest star is one of the brightest stars in the night sky, and forms a corner of the famed Summer Triangle asterism. Beta Lyrae is the prototype of a class of stars known as Beta Lyrae variables. These binary stars are so close to each other that they become egg-shaped and material flows from one to the other. Epsilon Lyrae, known informally as the Double Double, is a complex multiple star system. Lyra also hosts the Ring Nebula, the second-discovered and best-known planetary nebula."
Aur,Auriga,"Auriga is one of the 48 constellations listed by the 2nd-century astronomer Ptolemy and remains one of the 88 modern constellations. Located north of the celestial equator, its name is the Latin word for ""charioteer"", associating it with various mythological charioteers, including Erichthonius and Myrtilus. Auriga is most prominent during winter evenings in the Northern Hemisphere, along with the five other constellations that have stars in the Winter Hexagon asterism. Because of its northern declination, Auriga is only visible in its entirety as far as 34° south; for observers farther south it lies partially or fully below the horizon. A large constellation, with an area of 657 square degrees, it is half the size of the largest constellation, Hydra.
Its brightest star, Capella, is an unusual multiple star system among the brightest stars in the night sky. Beta Aurigae is an interesting variable star in the constellation; Epsilon Aurigae, a nearby eclipsing binary with an unusually long period, has been studied intensively. Because of its position near the winter Milky Way, Auriga has many bright open clusters in its borders, including M36, M37, and M38, popular targets for amateur astronomers. In addition, it has one prominent nebula, the Flaming Star Nebula, associated with the variable star AE Aurigae.
In Chinese mythology, Auriga's stars were incorporated into several constellations, including the celestial emperors' chariots, made up of the modern constellation's brightest stars. Auriga is home to the radiant for the Aurigids, Zeta Aurigids, Delta Aurigids, and the hypothesized Iota Aurigids."
Ser,Serpens,"Serpens (""the Serpent"", Greek Ὄφις) is a constellation of the northern hemisphere. One of the 48 constellations listed by the 2nd-century astronomer Ptolemy, it remains one of the 88 modern constellations defined by the International Astronomical Union. It is unique among the modern constellations in being split into two non-contiguous parts, Serpens Caput (Serpent Head) to the west and Serpens Cauda (Serpent Tail) to the east. Between these two halves lies the constellation of Ophiuchus, the ""Serpent-Bearer"". In figurative representations, the body of the serpent is represented as passing behind Ophiuchus between Mu Serpentis in Serpens Caput and Nu Serpentis in Serpens Cauda.
The brightest star in Serpens is the red giant star Alpha Serpentis, or Unukalhai, in Serpens Caput, with an apparent magnitude of 2.63. Also located in Serpens Caput are the naked-eye globular cluster Messier 5 and the naked-eye variables R Serpentis and Tau4 Serpentis. Notable extragalactic objects include Seyfert's Sextet, one of the densest galaxy clusters known; Arp 220, the prototypical ultraluminous infrared galaxy; and Hoag's Object, the most famous of the very rare class of galaxies known as ring galaxies.
Part of the Milky Way's galactic plane passes through Serpens Cauda, which is therefore rich in galactic deep-sky objects, such as the Eagle Nebula (IC 4703) and its associated star cluster Messier 16. The nebula measures 70 light-years by 50 light-years and contains the Pillars of Creation, three dust clouds that became famous for the image taken by the Hubble Space Telescope. Other striking objects include the Red Square Nebula, one of the few objects in astronomy to take on a square shape; and Westerhout 40, a massive nearby star-forming region consisting of a molecular cloud and an H II region."
Vir,Virgo,"Virgo is one of the constellations of the zodiac. Its name is Latin for virgin, and its symbol is ♍. Lying between Leo to the west and Libra to the east, it is the second largest constellation in the sky (after Hydra). It can be easily found through its brightest star, Spica."
